candidate,layer,predicted_effect,dev_score,write_pass_5,cost_per_100_conversations_usd,decision,git_commit,result_file
starting_version,none,baseline measurement,0.142857,0,0.066048,keep,eec0ebb,optimize/results/development-starting-gpt-4o-mini-20261001-212814.json
prompt_change,prompt,"e-009 flips to pass; mean rises about 0.14; the other five should not move. OUTCOME: e-009 flipped as predicted. e-002 also flipped and a rerun reproduced the 0.429 score, but e-002 then passed under tool_change too, so it is a flaky case that drew badly in the baseline, not an effect of this change. Attributable effect is +1 case, e-009, not +2",0.428571,0,0.060552,keep,d5ee4f1,optimize/results/development-prompt_change-gpt-4o-mini-20261001-213500.json (rerun: development-prompt_change_rerun-gpt-4o-mini-20261001-213835.json)
tool_change,tool,"weaker than the prompt change: cite_as keeps the id out of what the agent quotes, but SYSTEM_PROMPT_TEMPLATE still orders a policy id, so it may echo the id anyway. OUTCOME: correct. e-009 still fails and the reply still prints cw-. The instruction beat the affordance",0.285714,0,0.067795,revert,472cff1,optimize/results/development-tool_change-gpt-4o-mini-20261001-214135.json
harness_change,harness,"e-009 passes reliably because raw policy ids are rewritten on the way out, but the agent has not changed; this is the fix that makes the test green without fixing the behaviour. OUTCOME: wrong, and in an instructive way. Redaction works (a direct run confirms the model receives policy_name/'the applicable policy', never a raw id) yet e-009 still fails and the reply still prints '(policy id: cw-returns)'. The model is not copying the id from the tool, it is copying the literal example out of SYSTEM_PROMPT_TEMPLATE, 'Cite the policy id (for example cw-returns)'. Hiding the data cannot beat an instruction that carries its own sample value. The 0.0 overstates the harm: e-004 regressed only because the wrapper returns a JSON string where the tool returned a dict, so the tool_result_permission_denied check cannot inspect it (both replies refuse the lookup identically), and e-002 is a flaky case. Adjusted for both, this arm is level with the baseline",0.0,0,0.059695,revert,d2d0572,optimize/results/development-harness_change-gpt-4o-mini-20261001-214541.json
gepa_candidate_1,prompt,"PREDICTION (written before the rerun): GEPA keeps the RESP-1 rule verbatim so e-009 should hold, and its new refund language targets the three judge cases the manual arms never moved. OUTCOME: 0.571, the best development score, but not for the predicted reason. e-009 and e-004 hold and e-007 and e-008 flip to pass, both from the added escalation and data-integrity blocks, not from the refund language. The judge cases did not move: e-001 and e-002 still fail promises_unconfirmed_outcome, and e-012 swapped one failure for a worse one, from promising an unconfirmed outcome to never cancelling the order at all because the agent now demands a cancellation reason first. Cost rose 48 percent, 0.0981 against 0.0660 per 100 conversations, because the prompt is longer and the agent narrates before every tool call",0.571429,0,0.098077,keep,0487f7a,optimize/results/development-gepa-gpt-4o-mini-20261002-062528.json
